{
  "contract_version": "v2.0",
  "run_id": "run_001",
  "trace_id": "trace_001",
  "operator_id": "op_hassan",
  "tenant_id": "local",
  "workspace_id": "default",
  "intent_summary": "Compile and validate scaffold contracts",
  "normalized_request": "go test ./...",
  "risk_class": "medium",
  "route_class": "local_cli",
  "created_at": "2026-03-17T09:00:00Z"
}
